{"artifacts":[{"path":"Validation/030/SDR/Windows-Vulkan/Sponza/74e1c435-formal-20260916/candidate.json","sha256":"802c41c760a0e2ceeec0a5de94bf7ca7b34946560fb446d235d47f430f85fe05","sizeBytes":1084},{"path":"Validation/030/SDR/Windows-Vulkan/Sponza/74e1c435-formal-20260916/production-content-sponza-v3-vulkan-windows.discrete-vulkan.rgba8-candidate.png","sha256":"6d93309e0bd939a85e6c8bcf6d4251de6e1e6b54b0ce25699f1867648a982950","sizeBytes":546635},{"path":"Validation/030/SDR/Windows-Vulkan/Sponza/74e1c435-formal-20260916/calibration.json","sha256":"076efbe007193f73819d1c70f4ab7d95b421028041c40b7e1b6d811f3b325d1f","sizeBytes":2378},{"path":"Validation/030/SDR/Windows-Vulkan/Sponza/74e1c435-formal-20260916/native-probe.json","sha256":"3a057ea069b60de68b81af246cfc93708a483a9d02a5963ea87c102045297eb0","sizeBytes":982}],"backend":"vulkan","capabilityDigest":"c7cfed63c497d185858cb2f4bf693b568eb1df940d1b261a7cc4146b0fd7b03d","deviceClass":"windows.discrete-vulkan.rgba8","dynamicRange":"sdr","executionResult":"passed","executionTier":"sdr-image-authority","exposureStops":0,"extent":{"height":512,"width":512},"firstFailure":null,"frameToken":"41","gitRevision":"74e1c435ecd79056ef3d72c563ab4cd865a6ca19","hostPlatform":"windows","insertionDigest":"37517e5f3dc66819f61f5a7bb8ace1921282415f10551d2defa5c3eb0985b570","modeGeneration":1,"native":{"claimDisposition":"sdr-authority","colorSpace":"srgb-nonlinear","commandCompleted":true,"displayAdaptation":"none","format":"rgba8-unorm","hdrMetadataDigest":null,"presentationFrameToken":"41","presented":true,"readbackCompleted":true,"readbackFrameToken":"41"},"outputDeviceProfileId":"Sdr.sRGB.v1","rendererStrategy":"deferred","sceneColor":{"alphaMode":"opaque-one","format":"rgba16-float","primaries":"rec709","sampleCount":1,"transfer":"linear","whitePoint":"d65"},"schema":"stoner.output-validation-report","schemaVersion":1,"transferOwner":"renderer-output-device-stage","transformVersion":"Sdr.KhronosPbrNeutral.v1","visualAuthority":{"disposition":"not-required","reason":"SDR native validation requires no HDR visual authority."},"workloadRevision":"production-content-sponza-v3"}
