{"artifacts":[{"path":"Validation/030/SDR/Windows-Vulkan/Lantern/74e1c435-formal-20260916/native-probe.json","sha256":"cf579d147010a1daafd7ebbc922c1a5f06ae4dbff3c7ec6dc79a4b5adfe52db4","sizeBytes":983}],"backend":"vulkan","capabilityDigest":"c7cfed63c497d185858cb2f4bf693b568eb1df940d1b261a7cc4146b0fd7b03d","deviceClass":"windows.discrete-vulkan.rgba8","dynamicRange":"sdr","executionResult":"passed","executionTier":"native-nonvisual","exposureStops":0,"extent":{"height":512,"width":512},"firstFailure":null,"frameToken":"41","gitRevision":"74e1c435ecd79056ef3d72c563ab4cd865a6ca19","hostPlatform":"windows","insertionDigest":"37517e5f3dc66819f61f5a7bb8ace1921282415f10551d2defa5c3eb0985b570","modeGeneration":1,"native":{"claimDisposition":"nonvisual-only","colorSpace":"srgb-nonlinear","commandCompleted":true,"displayAdaptation":"none","format":"rgba8-unorm","hdrMetadataDigest":null,"presentationFrameToken":"41","presented":true,"readbackCompleted":true,"readbackFrameToken":"41"},"outputDeviceProfileId":"Sdr.sRGB.v1","rendererStrategy":"deferred","sceneColor":{"alphaMode":"opaque-one","format":"rgba16-float","primaries":"rec709","sampleCount":1,"transfer":"linear","whitePoint":"d65"},"schema":"stoner.output-validation-report","schemaVersion":1,"transferOwner":"renderer-output-device-stage","transformVersion":"Sdr.KhronosPbrNeutral.v1","visualAuthority":{"disposition":"not-required","reason":"SDR native validation requires no HDR visual authority."},"workloadRevision":"production-content-lantern-v3"}
