{"artifacts":[],"backend":"vulkan","capabilityDigest":"0000000000000000000000000000000000000000000000000000000000000000","deviceClass":"windows-hdr-no-claim","dynamicRange":"hdr","executionResult":"unsupported","executionTier":"deterministic-contract","exposureStops":0,"extent":{"height":512,"width":512},"firstFailure":null,"frameToken":"not-run","gitRevision":"2ee7116ffb382c021ed575aff223c7b760a2ce7d","hostPlatform":"windows","insertionDigest":"37517e5f3dc66819f61f5a7bb8ace1921282415f10551d2defa5c3eb0985b570","modeGeneration":0,"native":{"claimDisposition":"not-run","colorSpace":"not-run","commandCompleted":false,"displayAdaptation":"none","format":"not-run","hdrMetadataDigest":null,"presentationFrameToken":null,"presented":false,"readbackCompleted":false,"readbackFrameToken":null},"outputDeviceProfileId":"Hdr.PQ.Rec2020.1000.v1","rendererStrategy":"deferred","sceneColor":{"alphaMode":"opaque-one","format":"rgba16-float","primaries":"rec709","sampleCount":1,"transfer":"linear","whitePoint":"d65"},"schema":"stoner.output-validation-report","schemaVersion":1,"transferOwner":"renderer-output-device-stage","transformVersion":"Hdr.ACES2.0.0_2025-04-04.Rec2020D65.v1","visualAuthority":{"disposition":"not-required","reason":"Feature 029 makes no Windows HDR validation claim."},"workloadRevision":"output-transform-contract-v1"}
