{"artifacts":[{"path":"Validation/029/HDR/Probes/1f46352-20260904-01/edr2000.json","sha256":"7b9eb508943c708d1b3caa6df25b3630b140762fec9647aa1915067e620918b1","sizeBytes":1005}],"backend":"metal","capabilityDigest":"33bd01c06402c485a269c6e823c39168f1a77cf1c276e741165d37c123960931","deviceClass":"macos.apple8.metal.hdr","dynamicRange":"hdr","executionResult":"passed","executionTier":"native-nonvisual","exposureStops":0,"extent":{"height":512,"width":512},"firstFailure":null,"frameToken":"41","gitRevision":"1f463520006d2ade3d1b4375a51ad947dd7f1847","hostPlatform":"macos","insertionDigest":"37517e5f3dc66819f61f5a7bb8ace1921282415f10551d2defa5c3eb0985b570","modeGeneration":2,"native":{"claimDisposition":"nonvisual-only","colorSpace":"extended-srgb-linear","commandCompleted":true,"displayAdaptation":"none","format":"rgba16-float","hdrMetadataDigest":null,"presentationFrameToken":"41","presented":true,"readbackCompleted":true,"readbackFrameToken":"41"},"outputDeviceProfileId":"Hdr.Linear.2000.v1","rendererStrategy":"deferred","sceneColor":{"alphaMode":"opaque-one","format":"rgba16-float","primaries":"rec709","sampleCount":1,"transfer":"linear","whitePoint":"d65"},"schema":"stoner.output-validation-report","schemaVersion":1,"transferOwner":"renderer-output-device-stage","transformVersion":"Hdr.ACES2.0.0_2025-04-04.Rec2020D65.v1","visualAuthority":{"disposition":"manual-review-required","reason":"Native HDR state is non-visual evidence; live maintainer inspection is required."},"workloadRevision":"production-content-lantern-v3"}
