{"artifacts":[{"path":"Validation/029/SDR/M4-Metal/Sponza/2ee7116-20260906-01/native-probe.json","sha256":"c5468167616da0abbf2064bd59e260b206059a02656434141c476ee1a0902d50","sizeBytes":974}],"backend":"metal","capabilityDigest":"9c1b89b085618b275f60166e5069aa1650f8f904d4b976500c93445bbfd43ec6","deviceClass":"macos.apple8.metal.rgba8","dynamicRange":"sdr","executionResult":"passed","executionTier":"native-nonvisual","exposureStops":0,"extent":{"height":512,"width":512},"firstFailure":null,"frameToken":"41","gitRevision":"2ee7116ffb382c021ed575aff223c7b760a2ce7d","hostPlatform":"macos","insertionDigest":"37517e5f3dc66819f61f5a7bb8ace1921282415f10551d2defa5c3eb0985b570","modeGeneration":2,"native":{"claimDisposition":"nonvisual-only","colorSpace":"srgb-nonlinear","commandCompleted":true,"displayAdaptation":"none","format":"rgba8-unorm","hdrMetadataDigest":null,"presentationFrameToken":"41","presented":true,"readbackCompleted":true,"readbackFrameToken":"41"},"outputDeviceProfileId":"Sdr.sRGB.v1","rendererStrategy":"deferred","sceneColor":{"alphaMode":"opaque-one","format":"rgba16-float","primaries":"rec709","sampleCount":1,"transfer":"linear","whitePoint":"d65"},"schema":"stoner.output-validation-report","schemaVersion":1,"transferOwner":"renderer-output-device-stage","transformVersion":"Sdr.KhronosPbrNeutral.v1","visualAuthority":{"disposition":"not-required","reason":"SDR native validation requires no HDR visual authority."},"workloadRevision":"production-content-sponza-v3"}
