{"artifacts":[{"path":"Validation/029/HDR/Probes/1f46352-20260904-01/pq1000.json","sha256":"a71e4481c6e45cab6975813ef311a5541c84d22ca26c292a4938f68333c85c4f","sizeBytes":1029}],"backend":"metal","capabilityDigest":"572b3d57dbd12b03631a9cf0fb0157b539bd162b095d711ad1e807be0bac9b0c","deviceClass":"macos.apple8.metal.hdr","dynamicRange":"hdr","executionResult":"passed","executionTier":"native-nonvisual","exposureStops":0,"extent":{"height":512,"width":512},"firstFailure":null,"frameToken":"41","gitRevision":"1f463520006d2ade3d1b4375a51ad947dd7f1847","hostPlatform":"macos","insertionDigest":"37517e5f3dc66819f61f5a7bb8ace1921282415f10551d2defa5c3eb0985b570","modeGeneration":2,"native":{"claimDisposition":"nonvisual-only","colorSpace":"hdr10-st2084","commandCompleted":true,"displayAdaptation":"system-color-management","format":"bgr10a2-unorm","hdrMetadataDigest":null,"presentationFrameToken":"41","presented":true,"readbackCompleted":true,"readbackFrameToken":"41"},"outputDeviceProfileId":"Hdr.PQ.Rec2020.1000.v1","rendererStrategy":"deferred","sceneColor":{"alphaMode":"opaque-one","format":"rgba16-float","primaries":"rec709","sampleCount":1,"transfer":"linear","whitePoint":"d65"},"schema":"stoner.output-validation-report","schemaVersion":1,"transferOwner":"renderer-output-device-stage","transformVersion":"Hdr.ACES2.0.0_2025-04-04.Rec2020D65.v1","visualAuthority":{"disposition":"manual-review-required","reason":"Native HDR state is non-visual evidence; live maintainer inspection is required."},"workloadRevision":"production-content-lantern-v3"}
