{"artifacts":[{"path":"Validation/029/SDR/M4-Metal/Sponza/2ee7116-20260906-01/candidate.json","sha256":"d860ae98babab74d0ea7ea69d4cb039e414e2ea30f645327a5af552fddad4309","sizeBytes":1066},{"path":"Validation/029/SDR/M4-Metal/Sponza/2ee7116-20260906-01/production-content-sponza-v3-metal-macos.apple8.metal.rgba8-candidate.png","sha256":"4f72c4871fe51280f7db47f026059ca31150b2130d9f53f0d65eb9281eb249e7","sizeBytes":546865},{"path":"Validation/029/SDR/M4-Metal/Sponza/2ee7116-20260906-01/calibration.json","sha256":"eaa3dab909df478f7f775d53633e183da5906ec5c09482ea810bbec01aec44d6","sizeBytes":2294},{"path":"Validation/029/SDR/M4-Metal/Sponza/2ee7116-20260906-01/native-probe.json","sha256":"c5468167616da0abbf2064bd59e260b206059a02656434141c476ee1a0902d50","sizeBytes":974}],"backend":"metal","capabilityDigest":"9c1b89b085618b275f60166e5069aa1650f8f904d4b976500c93445bbfd43ec6","deviceClass":"macos.apple8.metal.rgba8","dynamicRange":"sdr","executionResult":"passed","executionTier":"sdr-image-authority","exposureStops":0,"extent":{"height":512,"width":512},"firstFailure":null,"frameToken":"41","gitRevision":"2ee7116ffb382c021ed575aff223c7b760a2ce7d","hostPlatform":"macos","insertionDigest":"37517e5f3dc66819f61f5a7bb8ace1921282415f10551d2defa5c3eb0985b570","modeGeneration":2,"native":{"claimDisposition":"sdr-authority","colorSpace":"srgb-nonlinear","commandCompleted":true,"displayAdaptation":"none","format":"rgba8-unorm","hdrMetadataDigest":null,"presentationFrameToken":"41","presented":true,"readbackCompleted":true,"readbackFrameToken":"41"},"outputDeviceProfileId":"Sdr.sRGB.v1","rendererStrategy":"deferred","sceneColor":{"alphaMode":"opaque-one","format":"rgba16-float","primaries":"rec709","sampleCount":1,"transfer":"linear","whitePoint":"d65"},"schema":"stoner.output-validation-report","schemaVersion":1,"transferOwner":"renderer-output-device-stage","transformVersion":"Sdr.KhronosPbrNeutral.v1","visualAuthority":{"disposition":"not-required","reason":"SDR native validation requires no HDR visual authority."},"workloadRevision":"production-content-sponza-v3"}
