{"artifacts":[{"path":"Validation/029/SDR/M4-Metal/Lantern/1f46352-20260904-01/native-probe.json","sha256":"d3456928fee3f8f400bf7a792b500d8b18e340e69a527fc7de3a5d7e01b22be4","sizeBytes":975}],"backend":"metal","capabilityDigest":"80e905a7c6506412a011de753cfb4f0fe9a03fa70f337e3836809e0b6146e2e5","deviceClass":"macos.apple8.metal.rgba8","dynamicRange":"sdr","executionResult":"passed","executionTier":"native-nonvisual","exposureStops":0,"extent":{"height":512,"width":512},"firstFailure":null,"frameToken":"41","gitRevision":"1f463520006d2ade3d1b4375a51ad947dd7f1847","hostPlatform":"macos","insertionDigest":"37517e5f3dc66819f61f5a7bb8ace1921282415f10551d2defa5c3eb0985b570","modeGeneration":2,"native":{"claimDisposition":"nonvisual-only","colorSpace":"srgb-nonlinear","commandCompleted":true,"displayAdaptation":"none","format":"rgba8-unorm","hdrMetadataDigest":null,"presentationFrameToken":"41","presented":true,"readbackCompleted":true,"readbackFrameToken":"41"},"outputDeviceProfileId":"Sdr.sRGB.v1","rendererStrategy":"deferred","sceneColor":{"alphaMode":"opaque-one","format":"rgba16-float","primaries":"rec709","sampleCount":1,"transfer":"linear","whitePoint":"d65"},"schema":"stoner.output-validation-report","schemaVersion":1,"transferOwner":"renderer-output-device-stage","transformVersion":"Sdr.KhronosPbrNeutral.v1","visualAuthority":{"disposition":"not-required","reason":"SDR native validation requires no HDR visual authority."},"workloadRevision":"production-content-lantern-v3"}
